{
  "_example_note": "Demonstration artifact for contracts/predict-view.schema.json. This example defines public display and intent metadata for a governed prediction experience without duplicating canonical dataset contract validation or input semantics.",
  "schema_version": "1.0.0",
  "view_id": "churn-risk-overview",
  "dataset_slug": "telco-customer-churn",
  "display": {
    "title": "Churn Risk Overview",
    "summary": "Estimate whether a telecommunications customer is likely to churn.",
    "description": "A public prediction experience focused on customer churn risk interpretation.",
    "tags": ["churn", "retention"]
  },
  "intent": {
    "prediction_goal": "Estimate customer churn likelihood from the canonical dataset contract inputs.",
    "audience": "Public visitors evaluating churn risk examples.",
    "usage_notes": "Use the canonical dataset contracts for required fields, accepted values, and runtime validation."
  },
  "binding": {
    "dataset_slug": "telco-customer-churn",
    "release": {
      "mode": "active"
    }
  },
  "contract_precedence": {
    "canonical_contracts_are_source_of_truth": true,
    "view_metadata_defines_runtime_validation": false,
    "view_metadata_duplicates_contract": false
  }
}
